Manuscript evidence tier,Directly measured feature requirement,Operational evidence-profile rule,Formula-style implementation,Required source fields,Observed score audit / count,Interpretation boundary,Manual-review trigger,source_file,source_sheet
Evidence Tier I,direct_detected_feature = TRUE,Mechanistic mapping support plus internal model-derived support.,"IF(AND(direct_detected_feature=TRUE, Mechanism_score>0, Model_score>0), ""Evidence Tier I"", next rule)",direct_detected_feature; Mechanism_score; Model_score; mechanism_module; model_support_raw_bin; model_source,15 directly measured candidates; microbiome=5; metabolome=10. Conservative_total_score range reported in S5 as audit.,Integrated high-priority candidate fingerprints for mechanistic and state-model interpretation; not clinical biomarkers.,Mechanism_score or Model_score derived from ambiguous/non-locked source; mechanism/model evidence mismatch; feature is model-derived meta-feature.,<PROJECT_ROOT>\Supplementary material\Supplementary_Table_S4_six_dimension_scoring_framework_revised_tier_rules_with_formulas.xlsx,ST3c_tier_assignment_rules
Evidence Tier II,direct_detected_feature = TRUE and Tier I rule not met,"Model-prioritized or model-supported evidence with incomplete, absent, or less direct mechanism support.","IF(AND(Tier_I_not_met, direct_detected_feature=TRUE, Model_score>0, OR(model_evidence_present=TRUE, model_prioritized_category=TRUE)), ""Evidence Tier II"", next rule)",direct_detected_feature; Model_score; model_evidence_present; candidate_category; model_prioritized_category; Mechanism_score,313 directly measured candidates; microbiome=198; metabolome=115. Conservative_total_score range reported in S5 as audit.,Recurrent/model-supported exploratory feature layer for validation and hypothesis generation.,Model_score from exploratory-only model; missing model source; candidate category inconsistent with score.,<PROJECT_ROOT>\Supplementary material\Supplementary_Table_S4_six_dimension_scoring_framework_revised_tier_rules_with_formulas.xlsx,ST3c_tier_assignment_rules
Evidence Tier III,direct_detected_feature = TRUE and result-level candidate inclusion criteria met,Retained traceable exploratory candidate that does not satisfy Tier I/II rules.,"IF(AND(direct_detected_feature=TRUE, result_level_evidence_present=TRUE, Tier_I_not_met, Tier_II_not_met), ""Evidence Tier III"", ""Not tiered"")",direct_detected_feature; result_level_evidence_present; Matched_evidence_types; Tier_I_rule_check; Tier_II_rule_check,171 directly measured candidates; microbiome=142; metabolome=29. Some Conservative_total_score fields may be unavailable due to incomplete scoring evidence.,Context-specific evidence-supported candidates retained for transparency; lower-priority exploratory layer.,No result-level evidence; ambiguous feature identity; direct-detection status unclear.,<PROJECT_ROOT>\Supplementary material\Supplementary_Table_S4_six_dimension_scoring_framework_revised_tier_rules_with_formulas.xlsx,ST3c_tier_assignment_rules
Integrated multiomics meta-features,direct_detected_feature = FALSE,Late-fusion prediction-probability features or other model-derived meta-features are not counted among 499 directly measured biological candidates.,"IF(direct_detected_feature=FALSE, ""Integrated multiomics meta-feature / not counted in 499"", tier rules not applied)",direct_detected_feature; meta_feature_flag; source_model; feature_origin,2 model-derived meta-features reported separately; not part of the 499 directly measured candidates.,Model-derived meta-feature analysis only.,Any meta-feature mixed into directly measured microbiome/metabolome candidate counts.,<PROJECT_ROOT>\Supplementary material\Supplementary_Table_S4_six_dimension_scoring_framework_revised_tier_rules_with_formulas.xlsx,ST3c_tier_assignment_rules
Row-level Excel formula template,,,,,,,,<PROJECT_ROOT>\Supplementary material\Supplementary_Table_S4_six_dimension_scoring_framework_revised_tier_rules_with_formulas.xlsx,ST3c_tier_assignment_rules
"Formula template: =IF(direct_detected_feature<>TRUE,""Integrated multiomics meta-feature / not counted in 499"",IF(AND(Mechanism_score>0,Model_score>0),""Evidence Tier I"",IF(AND(Model_score>0,OR(model_evidence_present=TRUE,model_prioritized_category=TRUE)),""Evidence Tier II"",IF(result_level_evidence_present=TRUE,""Evidence Tier III"",""Not tiered / insufficient result-level evidence""))))",,,,,,,,<PROJECT_ROOT>\Supplementary material\Supplementary_Table_S4_six_dimension_scoring_framework_revised_tier_rules_with_formulas.xlsx,ST3c_tier_assignment_rules
Missing-evidence rule: blank fields mean unavailable evidence and are not interpreted as negative biological evidence. Missing dimensions contribute 0 to Conservative_total_score and reduce Evidence_completeness.,,,,,,,,<PROJECT_ROOT>\Supplementary material\Supplementary_Table_S4_six_dimension_scoring_framework_revised_tier_rules_with_formulas.xlsx,ST3c_tier_assignment_rules
